{
  "schema_version": "w1.private.w2.commit-gate.v1",
  "message_id": "20000000-0000-4000-8000-000000000004",
  "message_type": "w1.private.w2.commit-gate.v1",
  "producer": "w1",
  "visibility_scope": "PRIVATE",
  "operation_id": "21000000-0000-4000-8000-000000000001",
  "operation_revision": 5,
  "action": "PURGE",
  "command_id": "22000000-0000-4000-8000-000000000001",
  "job_id": "23000000-0000-4000-8000-000000000001",
  "authenticated_owner_ref": "24000000-0000-4000-8000-000000000001",
  "execution_fence": 3,
  "owner_deletion_epoch": 0,
  "purge_owner_deletion_epoch": 1,
  "result_digest": "sha256:aaaaaaaaaaaaaaaaaaaaaaaaaaaaaaaaaaaaaaaaaaaaaaaaaaaaaaaaaaaaaaaa",
  "issued_at": "2026-09-17T00:00:02Z"
}
